{
  "avoid_list": [
    {
      "detail": "Post-October-2026 tightening: the clipping industry's revenue was hit (payments KSh 130-520 per 1K views, Kenyan Mirror, Oct 5 2026), Shorts re-upload channels face reach reduction from Oct 1, 2026 (this site's October 2026 research snapshot), and reposted clips with little commentary are flagged unoriginal and FYP-ineligible on TikTok.",
      "id": "clipping-reposts",
      "name": "Clipping / repost channels",
      "sources": [
        "kenyanmirror",
        "buytiktok"
      ]
    },
    {
      "detail": "YouTube's January 2026 inauthentic-content enforcement removed 16 major channels (4.7B combined views) and demonetized thousands of low-effort AI channels (UTubeKit, Jul 2026). Risky faceless formats: AI personas giving money or health advice (unmonetizable), article readings, clip compilations, templated top-5 lists (Synthesys, Oct 2026). Faceless still works \u2014 but only with visible human creativity.",
      "id": "ai-slop",
      "name": "Low-effort AI slop",
      "sources": [
        "utubekit",
        "synthesys",
        "lilachbullock"
      ]
    },
    {
      "detail": "Fastest channel growth measured (1.59%/mo) but the worst pay: $0.33 RPM \u2014 about 3M views to earn $1,000 (AIR Media-Tech). Growth is not revenue. Made-for-kids content also faces strict ad rules.",
      "id": "kids-trap",
      "name": "The kids-content trap",
      "sources": [
        "air-tubeai"
      ]
    },
    {
      "detail": "Documented removal risk on TikTok (buyTikTokAccount, Aug 2026).",
      "id": "tiktok-gambling-crypto",
      "name": "Gambling / crypto on TikTok",
      "sources": [
        "buytiktok"
      ]
    },
    {
      "detail": "Flagged and FYP-ineligible (buyTikTokAccount, Aug 2026). Health education is fine; claims and diagnoses are not.",
      "id": "tiktok-medical-claims",
      "name": "Medical-advice claims on TikTok",
      "sources": [
        "buytiktok"
      ]
    },
    {
      "detail": "FYP-ineligible as a category (buyTikTokAccount, Aug 2026).",
      "id": "tiktok-news-politics",
      "name": "Pure news / politics on TikTok",
      "sources": [
        "buytiktok"
      ]
    }
  ],
  "growth_context": "Channel-growth figures below are median monthly subscriber growth among 10K-100K-subscriber YouTube channels in the AIR Media-Tech / TubeAI study (Sep 7-27, 2026). The all-channel median was 0.97%/mo. Medians hide huge variance \u2014 they describe the middle of a cohort, not your outcome.",
  "niches": [
    {
      "breakout_rate": "10.0% of videos beat channel average 10x",
      "case_file": null,
      "caveats": [
        "Channel growth 1.44%/mo is the AI & ML cohort median (TubeAI, Sep 2026).",
        "Competition rising fast \u2014 speed and specificity beat breadth here."
      ],
      "channel_growth_monthly_pct": 1.44,
      "chapter_links": [
        {
          "label": "Phase 2: YouTube Mastery",
          "page": "phase-2-youtube-mastery.html"
        },
        {
          "label": "Phase 5: The Monetization Stack",
          "page": "phase-5-monetization-stack.html"
        }
      ],
      "competition": "medium",
      "formats": [
        "long-form",
        "shorts"
      ],
      "id": "ai-tools",
      "name": "AI Tools & Automation",
      "platforms": [
        "YouTube long-form",
        "TikTok",
        "YouTube Shorts"
      ],
      "revenue_figures": [
        {
          "hi": 20,
          "kind": "CPM",
          "lo": 8,
          "note": "creator-reported (OutlierKit, Sep 2026)"
        }
      ],
      "revenue_tier": "high",
      "search_growth_pct": 340,
      "simulator_scenario": null,
      "single_source": false,
      "skill_fit": [
        "teaching",
        "research"
      ],
      "sources": [
        "air-tubeai",
        "outlierkit-search",
        "outlierkit-breakout"
      ],
      "startup_cost": "low",
      "summary": "Tutorials and breakdowns of AI tools, prompts, and automation workflows \u2014 the fastest-rising search niche of 2026."
    },
    {
      "breakout_rate": null,
      "case_file": null,
      "caveats": [
        "'Most underserved' and the $10-25 CPM range both come from one source (OutlierKit). Screen-recorded tutorials keep startup cost near zero."
      ],
      "channel_growth_monthly_pct": null,
      "chapter_links": [
        {
          "label": "Phase 2: YouTube Mastery",
          "page": "phase-2-youtube-mastery.html"
        },
        {
          "label": "Phase 5: The Monetization Stack",
          "page": "phase-5-monetization-stack.html"
        }
      ],
      "competition": "low",
      "formats": [
        "long-form",
        "shorts"
      ],
      "id": "no-code-automation",
      "name": "No-Code & Automation Workflows",
      "platforms": [
        "YouTube long-form",
        "YouTube Shorts"
      ],
      "revenue_figures": [
        {
          "hi": 25,
          "kind": "CPM",
          "lo": 10,
          "note": "creator-reported (OutlierKit, Sep 2026)"
        }
      ],
      "revenue_tier": "high",
      "search_growth_pct": 220,
      "simulator_scenario": null,
      "single_source": true,
      "skill_fit": [
        "teaching",
        "research"
      ],
      "sources": [
        "outlierkit-search"
      ],
      "startup_cost": "low",
      "summary": "No-code tools, Zapier/Make-style automations, and AI-agent workflows for businesses \u2014 called the most underserved niche in the 2026 research."
    },
    {
      "breakout_rate": "16.7% of videos beat channel average 10x",
      "case_file": {
        "page": "case-ptya.html",
        "title": "The Cohort Course"
      },
      "caveats": [
        "The math forgives a small audience \u2014 but never present ranges as earnings. Educational content, not financial advice."
      ],
      "channel_growth_monthly_pct": null,
      "chapter_links": [
        {
          "label": "Phase 5: The Monetization Stack",
          "page": "phase-5-monetization-stack.html"
        },
        {
          "label": "Phase 7: The Business",
          "page": "phase-7-the-business.html"
        }
      ],
      "competition": "high",
      "formats": [
        "long-form",
        "shorts"
      ],
      "id": "gen-z-finance",
      "name": "Gen Z Personal Finance",
      "platforms": [
        "YouTube long-form",
        "TikTok",
        "YouTube Shorts"
      ],
      "revenue_figures": [
        {
          "hi": 45,
          "kind": "CPM",
          "lo": 18,
          "note": "creator-reported (OutlierKit/Famety, 2026)"
        },
        {
          "hi": 35,
          "kind": "RPM",
          "lo": 8,
          "note": "finance/business band (OutlierKit, Jun 2026); roughly 7x gaming/entertainment"
        }
      ],
      "revenue_tier": "high",
      "search_growth_pct": 180,
      "simulator_scenario": "personal-finance",
      "single_source": false,
      "skill_fit": [
        "teaching",
        "research"
      ],
      "sources": [
        "outlierkit-search",
        "outlierkit-cpm",
        "famety",
        "outlierkit-breakout"
      ],
      "startup_cost": "low",
      "summary": "Budgeting, investing basics, and money psychology for a young audience \u2014 the highest breakout rate of any niche measured."
    },
    {
      "breakout_rate": null,
      "case_file": null,
      "caveats": [
        "Search growth +160% and the $12-28 CPM range both come from one source (OutlierKit)."
      ],
      "channel_growth_monthly_pct": null,
      "chapter_links": [
        {
          "label": "Phase 2: YouTube Mastery",
          "page": "phase-2-youtube-mastery.html"
        }
      ],
      "competition": "low",
      "formats": [
        "long-form",
        "shorts"
      ],
      "id": "cybersecurity",
      "name": "Cybersecurity & Privacy",
      "platforms": [
        "YouTube long-form",
        "YouTube Shorts"
      ],
      "revenue_figures": [
        {
          "hi": 28,
          "kind": "CPM",
          "lo": 12,
          "note": "creator-reported (OutlierKit, Sep 2026)"
        }
      ],
      "revenue_tier": "high",
      "search_growth_pct": 160,
      "simulator_scenario": null,
      "single_source": true,
      "skill_fit": [
        "teaching",
        "research"
      ],
      "sources": [
        "outlierkit-search"
      ],
      "startup_cost": "low",
      "summary": "Hacking explained, privacy tools, and scam breakdowns \u2014 high advertiser demand, thin competition."
    },
    {
      "breakout_rate": "21x growth",
      "case_file": {
        "page": "case-poly-couple.html",
        "title": "The Poly Couple"
      },
      "caveats": [
        "Short-form RPMs are the lowest per view ($0.04-0.50 per 1K Shorts views, site data) \u2014 volume and series retention do the work here."
      ],
      "channel_growth_monthly_pct": null,
      "chapter_links": [
        {
          "label": "Playbook: The Short-Form Playbook",
          "page": "shortform-playbook.html"
        },
        {
          "label": "Phase 3: The Everywhere Engine",
          "page": "phase-3-everywhere-engine.html"
        }
      ],
      "competition": "low",
      "formats": [
        "shorts",
        "tiktok"
      ],
      "id": "betrayal-dramas",
      "name": "Betrayal & Revenge Mini-Dramas",
      "platforms": [
        "TikTok",
        "YouTube Shorts",
        "Reels"
      ],
      "revenue_figures": [
        {
          "hi": 25,
          "kind": "CPM",
          "lo": 20,
          "note": "creator-reported (OutlierKit, 2026)"
        }
      ],
      "revenue_tier": "high",
      "search_growth_pct": null,
      "simulator_scenario": "serialized-mini-drama",
      "single_source": false,
      "skill_fit": [
        "personality",
        "voice"
      ],
      "sources": [
        "outlierkit-trending",
        "buytiktok"
      ],
      "startup_cost": "low",